ID,Title,Content,_wpml_import_language_code,_wpml_import_source_language_code,_wpml_import_translation_group,Summary,Slider_type,Slider_image,Slider_video,Slider_video_thumbnail,"Globe thumbnail image (220x122)","Card Layout","Featured card Image (450x250)","Timeline Thumbnail Image (120x120)","Start Year","End Year (optional)","Historical Context",Location,"Company (Optional)","Company Logo (140x60) (Optional)","Era Highlight (optional)","Highlight Text","Publish To Live","Publish To Staging",Date,Status,Slug
75992,"2017 - UK triggers Article 50, formally starting BREXIT","<p>The United Kingdom triggers Article 50 of the Lisbon Treaty, starting the Brexit negotiations, the talks for the United Kingdom to leave the European Union</p>
<p>The Saudi Arabian Stock Exchange and a major bank name women as their chief executives</p>
<p>Donald Trump, a Republican New York City businessman, is sworn in as the 45th President of the United States - the first person to be elected who was neither a political office holder nor a military general</p>
<p>In Saudi Arabia, the ban of women driving is formally lifted</p>
<p>A total solar eclipse is visible within a band across the entire contiguous USA passing from the Pacific to the Atlantic coasts</p>
<p>The United States announces its decision to withdraw from UNESCO, and is immediately followed by Israel.</p>",en,,669915,<p>&nbsp;</p>,image|image|image,https://media.alj.com/app/uploads/2020/07/big-trigger-1.jpg|https://media.alj.com/app/uploads/2020/07/big-trigger-3.jpg|https://media.alj.com/app/uploads/2020/07/big-trigger-4.jpg,||,||,https://media.alj.com/app/uploads/2020/07/globe-trigger.jpg,small-image,https://media.alj.com/app/uploads/2020/07/feature-trigger.jpg,https://media.alj.com/app/uploads/2020/07/2017-The-United-Kingdom-triggers-Article-50.jpg,01/01/2017,,world,GB,,,,,1,1,"2020-07-22 07:58:35",publish,the-united-kingdom-triggers-article-50-of-the-lisbon-treaty-starting-the-brexit-negotiations
76035,"2018 - IPCC releases Special Report on Global Warming of 1.5ºC,","<p>The IPCC releases its Special Report on Global Warming of 1.5ºC, warning that ""rapid, far-reaching and unprecedented changes in all aspects of society"" are needed to ensure that global warming is kept below 1.5 °C</p>
<p>The EU–Japan Economic Partnership Agreement is signed, the world's largest bilateral free trade deal, creating an open trade zone covering nearly one-third of global GDP</p>
<p>Ethiopia signs a peace deal with Eritrea</p>
<p>The share price of Facebook drops by almost 20 percent after the company warns investors that user growth has slowed following the data leak scandal</p>
<p>The United States leaves the Iran Nuclear Deal</p>
<p>The wedding of Prince Harry and Meghan Markle is held at St George's Chapel, England, with an estimated global audience of 1.9 billion</p>",en,,669922,<p>&nbsp;</p>,image|image|image,https://media.alj.com/app/uploads/2020/07/big-ipcc-1.jpg|https://media.alj.com/app/uploads/2020/07/big-ipcc-2.jpg|https://media.alj.com/app/uploads/2020/07/big-ipcc-3.jpg,||,||,https://media.alj.com/app/uploads/2020/07/globe-ipcc.jpg,small-image,,https://media.alj.com/app/uploads/2020/07/small-ipcc.jpg,01/01/2018,,world,US,,,,,1,1,"2020-07-22 08:02:05",publish,the-ipcc-releases-its-special-report-on-global-warming-of-1-5oc-warning-that-rapid-far-reaching-and-unprecedented-changes-in-all-aspects-of-society-are-needed
76078,"2019 - Toyota Motor Corporation celebrates 10 million sales of the iconic Toyota Landcruiser worldwide","<p>Pope Francis arrives in Abu Dhabi, United Arab Emirates, becoming the first pope to visit the Arabian Peninsula</p>
<p>The first ever image of a black hole was captured, using eight different telescopes taking simultaneous pictures, timed with extremely precise atomic clocks</p>
<p>A series of bomb attacks occur at eight locations in Sri Lanka, including three churches, four hotels and one housing complex in Colombo, on Easter Sunday, leaving 259 people dead and over 500 injured. It is the first major terrorist attack in the country since the Sri Lankan Civil War ended in 2009</p>
<p>British Prime Minister Theresa May announces her resignation as Conservative leader, effective June 7, 2019</p>
<p>US President Donald Trump makes a state visit to the United Kingdom, meeting with Queen Elizabeth II and outgoing Prime Minister Theresa May. It is the first official state visit to the UK by a sitting US president since 2011</p>
<p>Over 1 million people in Hong Kong protest against proposed legislation regarding extradition to China. It is the largest protest in Hong Kong since the 1997 handover</p>
<p>Brazil's National Institute for Space Research (INPE) reports fires burning in the Amazon rainforest at a record rate, with more than 36,000 in the year to date, while smoke reaches São Paulo more than 2,700 kilometres away</p>
<p>WikiLeaks co-founder Julian Assange is arrested after seven years in Ecuador's embassy in London</p>
<p>An estimated one million people march through London in a protest organised by People's Vote, to demand a second referendum on Brexit</p>
<p>The COVID-19 pandemic begins in Wuhan, Hubei, China</p>",en,,669929,<p>&nbsp;</p>,image|image|image,https://media.alj.com/app/uploads/2020/07/big-motor-1.jpg|https://media.alj.com/app/uploads/2020/07/big-motor-2.jpg|https://media.alj.com/app/uploads/2020/07/big-motor-3.jpg,||,||,https://media.alj.com/app/uploads/2020/07/globe-motor.jpg,small-image,https://media.alj.com/app/uploads/2020/07/feature-motor.jpg,https://media.alj.com/app/uploads/2020/07/2019-Toyota-Motor-Corporation-celebrates-10-million-sales.jpg,01/01/2019,,world,AE,,,,,1,1,"2020-07-22 08:04:59",publish,toyota-motor-corporation-celebrates-10-million-sales-of-the-iconic-toyota-landcruiser-worldwide-since-launches
76248,"1909 - Abdul Latif Jameel is born","<p>Many nations we recognize today, including the Kingdom of Saudi Arabia, simply didn't yet exist.  It was a time before the two great conflicts of World War I and II, and a time before oil became the lubricant of world industry and transportation.</p>
<p>Over the decades of his early life, Abdul Latif Jameel would learn to see opportunities all around him and develop a vision of business that helped to also develop the communities and lives of the people in which it operated.  This purpose-based approach, combined with a focus on continual improvement and customer service learned from his deep relationship with Japanese business, Toyota, would shape the future nature and philosophy of businesses to come.</p>",en,,669961,"<p>In Jeddah 1909, the late Sheikh Abdul Latif Jameel was born into a world very different to that of today.</p>",image,https://media.alj.com/app/uploads/2020/06/big-story-3.jpg,,,https://media.alj.com/app/uploads/2020/06/big-story-3.jpg,big-image,https://media.alj.com/app/uploads/2020/06/big-story-3.jpg,,01/01/1909,,alj,SA,,,,,1,1,"2020-08-04 12:23:51",publish,abdul-latif-jameel-born-1909
80667,"2020 - Jameel Family celebrates three quarters of a century of philanthropy","<p>2020 sees a special celebration as it marks three quarters of a century of the Jameel Family's global philanthropic work started by our late founder, Abdul Latif Jameel, which over these seven-and-half decades has touched the lives of many, and continued today through Bab Rizq Jameel,  Art Jameel Community Jameel Saudi and Community Jameel. </p>
<p>The Jameel family embarks on new chapter of supporting the community which sees Bab Rizq Jameel and Art Jameel become standalone units, a new focus is put in place for Community Jameel Saudi Arabia, and Community Jameel leverages science, technology and learning to achieve breakthroughs in the fields of education, health and climate, to deliver innovative solutions for a better future.</p>
<p>Nafisa Shams launches a new business incubator for entrepreneurial women in Saudi Arabia.<br />
 <br />
New Comedy Jameel competition supports and inspires comedic performers in Saudi Arabia and beyond.<br />
 <br />
The Royal College of Music and Community Jameel establish Hardship Fund.<br />
 <br />
Community Jameel and Imperial College London create a new initiative to scale up innovative and crucial coronavirus projects. This will provide new support for major research projects into the impact, understanding, prevention, diagnosis, and treatment of COVID-19.<br />
 <br />
The Jameel Institute at Imperial College London launches new tool to help hospitals manage pandemic capacity.<br />
 <br />
The Abdul Latif Jameel Poverty Action Lab (J-PAL) launches new regional research center in Cairo, Egypt, to help improve lives across MENA region.</p>
<p>Researchers at MIT discover powerful new antibiotic, Halicin, using AI technology.</p>",en,,670542,"<p>Jameel Family celebrates three quarters of a century of philanthropy</p>",image|image|image|image|image|image|image|image,https://media.alj.com/app/uploads/2020/10/Family-Philanthropy.png|https://media.alj.com/app/uploads/2020/10/Nafisa-Shams-495.jpg|https://media.alj.com/app/uploads/2020/10/Comedy-Jameel-1.jpg|https://media.alj.com/app/uploads/2020/10/RCM-Entrance.jpg|https://media.alj.com/app/uploads/2020/10/Jameel-Institute-COVID-19.jpg|https://media.alj.com/app/uploads/2020/10/Dr-Katharina-Hauck-Deputy-Director-of-the-Jameel-Institute-752x357-1-1.jpg|https://media.alj.com/app/uploads/2020/10/JPAL-MENA-Research-Centre-752x357-1-1.jpg|https://media.alj.com/app/uploads/2020/07/2020-Researchers-at-MIT-discover-powerful-new-antibiotic-Halicin.jpg,|||||||,|||||||,https://media.alj.com/app/uploads/2020/10/Family-Philanthropy-1.png,big-image,https://media.alj.com/app/uploads/2020/10/Family-Philanthropy-1.png,,01/01/2020,,cjameel,SA,,,,,1,1,"2020-10-28 10:49:06",publish,2020-community-jameel-celebrates-three-quarters-of-a-century-of-the-jameel-familys-philanthropy
81214,"1950s - Our relationship with Toyota grows","<p>Pictured: (left) Sheikh Abdul Latif Jameel and (right) Mr. Inue of Toyota Motor Corporation, during his visit to the Abdul Latif Jameel business in Jeddah, Saudi Arabia, in the late 1950s.</p>",en,,670593,"<p>As the Abdul Latif Jameel relationship with Toyota Motor Corporation continues to grow, executives from Japan are welcomed to Jeddah.</p>",image,https://media.alj.com/app/uploads/2020/11/15-scaled.jpg,,,https://media.alj.com/app/uploads/2020/11/15-scaled.jpg,big-image,https://media.alj.com/app/uploads/2020/11/1950SA2.jpg,,11/01/1959,,alj,SA,,,,,1,1,"2020-11-16 05:24:19",publish,1950s-our-relationship-with-toyota-grows
81245,"1950s - The first visit to Toyota Motor Corporation's Headquarters, Japan","<p>Pictured: Sheikh Abdul Latif Jameel (center-left) with Mr. Kato and other senior executives from Toyota Motor Corporation on his first visit to Toyota Motor Corporation's headquarters in Japan.</p>
<p>&nbsp;</p>",en,,670596,"<p>The start of an enduring partnership of mutual respect, trust and cooperation.</p>",image,https://media.alj.com/app/uploads/2020/11/12.jpg,,,https://media.alj.com/app/uploads/2020/11/12.jpg,big-image,https://media.alj.com/app/uploads/2020/11/1950SA1.jpg,,10/10/1954,,alj,JP,,,,,1,1,"2020-11-16 05:39:52",publish,1950s-the-first-visit-to-toyota-motor-corporations-headquarters-japan
81262,"1950s - Building our distribution infrastructure","<p>Pictured: (far-right) Sheikh Abdul Latif Jameel with Mr. Tanaka (center) of Toyota Motor Corporation, and  Abdul Latif Jameel associates at our Al Khumra National Distribution Center, outside Jeddah, Saudi Arabia.</p>
<p><span data-contrast=""auto"">Our central warehousing and port processing facilities in Saudi Arabia have the capacity to receive and dispatch </span><span data-contrast=""auto"">900</span><span data-contrast=""auto""> vehicles per day with stocking capacity for </span><span data-contrast=""auto"">40</span><span data-contrast=""auto"">,</span><span data-contrast=""auto"">0</span><span data-contrast=""auto"">00 </span><span data-contrast=""auto"">vehicles. </span><span data-ccp-props=""{}""> </span></p>",en,,670599,"<p><span data-contrast=""auto"">To support our successful transportation sector businesses, Abdul Latif Jameel has developed one of the region’s largest automotive supply infrastructures.</span><span data-ccp-props=""{}""> </span></p>",image,https://media.alj.com/app/uploads/2020/11/4.jpg,,,https://media.alj.com/app/uploads/2020/11/4.jpg,big-image,https://media.alj.com/app/uploads/2020/11/1950SM1.jpg,,01/07/1956,,alj,SA,,,,,1,1,"2020-11-16 05:58:53",publish,1950s-building-our-distribution-infrastructure
81280,"1960s - The business begins to grow","<p>Pictured: Sheikh Abdul Latif Jameel at his desk in the company's head office, Jeddah, Saudi Arabia, early 1960s.</p>",en,,670602,"<p>The fledgling Toyota business begins to expand.</p>",image,https://media.alj.com/app/uploads/2020/11/16-scaled.jpg,,,https://media.alj.com/app/uploads/2020/11/16-scaled.jpg,big-image,https://media.alj.com/app/uploads/2020/11/1960SA1.jpg,,01/01/1960,,alj,SA,,,,,1,1,"2020-11-16 06:08:50",publish,1960s-the-business-begins-to-grow
81295,"1960s - First retail parts outlet opens","<p>Pictured: (left) Parts &amp; Service Representative from Toyota Motor Corporation and Sheikh Abdul Latif Jameel outside the first retail parts outlet, Jeddah, Saudi Arabia.</p>",en,,670605,"<p>As Toyota vehicle sales increased, the need for comprehensive parts distribution to support 'guest first' service began.</p>",image,https://media.alj.com/app/uploads/2020/11/1.jpg,,,https://media.alj.com/app/uploads/2020/11/1.jpg,big-image,https://media.alj.com/app/uploads/2020/11/1960ST1.jpg,,10/01/1961,,alj,SA,,,,,1,1,"2020-11-16 09:53:35",publish,1960s-first-retail-parts-outlet-opens
81320,"1960s - The business begins to grow","<p>Pictured: (left) Khaled Al Habash, Abdul Latif Jameel Company's first Vice President, in a business meeting with Sheikh Abdul Latif Jameel at the Company's head quarters in Jeddah, Saudi Arabia, early 1960s.</p>",en,,670608,"<p>With growth and more to manage, the Company appoints it first ever Vice President.</p>",image,https://media.alj.com/app/uploads/2020/11/2.jpg,,,https://media.alj.com/app/uploads/2020/11/2.jpg,big-image,https://media.alj.com/app/uploads/2020/11/1960SK1.jpg,,10/10/1960,,alj,SA,,,,,1,1,"2020-11-16 10:51:54",publish,1960s-the-business-begins-to-grow-2
81338,"1960s - Part of a global enterprise","<p>Pictured: (left) Sheikh Abdul Latif Jameel and (center) Khalid Habash attending the Toyota Motor Corporation Distributor Convention in the 1960s, Tokyo, Japan.</p>",en,,670611,"<p>The Abdul Latif Jameel Toyota Distributorship in Saudi Arabia is now firmly established as part of a global family.</p>",image,https://media.alj.com/app/uploads/2020/11/25-scaled.jpg,,,https://media.alj.com/app/uploads/2020/11/25-scaled.jpg,big-image,https://media.alj.com/app/uploads/2020/11/1960SA2.jpg,,07/10/1963,,alj,SA,,,,,1,1,"2020-11-16 10:59:35",publish,1960s-part-of-a-global-enterprise
81353,"1960s - A common philosophy","<p>Pictured: (left) Sheikh Abdul Latif Jameel  at dinner with (right) Mr. Aioke, Vice President of Toyota Motor Sales.</p>
<p>From the very beginning, Abdul Latif Jameel and Toyota Motor Corporation shared a common philosophy of treating our customers as guests and placing them at the center of our thinking whilst also concentrating on continually improving everything we do.</p>",en,,670614,"<p>'Continuous Improvement' (Kaizen) and 'Guests First'  articulated commonly shared values between Abdul Latif Jameel and Toyota Motor Corporation.</p>",image,https://media.alj.com/app/uploads/2020/11/28.jpg,,,https://media.alj.com/app/uploads/2020/11/28.jpg,big-image,https://media.alj.com/app/uploads/2020/11/1960SA3.jpg,,03/31/1965,,alj,SA,,,,,1,1,"2020-11-16 11:11:07",publish,1960s-a-common-philosophy
81368,"1970s - New facilities, new opportunities and new customers","<p>Pictured: Sheikh Abdul Latif Jameel (center) with staff and guests at the inauguration of the new Abdul Latif  Jameel Toyota Center in Riyadh, Saudi Arabia, 1970s.</p>",en,,670617,"<p>Increasing demand for Toyota vehicles required expanding a network of facilities across the country.</p>",image,https://media.alj.com/app/uploads/2020/11/18-scaled.jpg,,,https://media.alj.com/app/uploads/2020/11/18-scaled.jpg,big-image,https://media.alj.com/app/uploads/2020/11/1970SA1.jpg,https://media.alj.com/app/uploads/2020/11/1970SA1.jpg,06/06/1972,,alj,SA,,,,,1,1,"2020-11-16 11:17:50",publish,1970s-new-facilities-new-opportunities-and-new-customers
81383,"1980s - A growing team","<p>Pictured: Sheikh Abdul Latif Jameel (center), Mohammed Jameel (far right) and the Company management team, Jeddah, Saudi Arabia, early 1908s.</p>",en,,670620,"<p>The 1980s was a decade of growth and expansion with new business ventures including, the recent creation of a consumer finance business; one of the first out-of-home media companies, and the recently formed electronics, consumer goods and air conditioning distribution and retail business.</p>",image,https://media.alj.com/app/uploads/2020/11/9.jpg,,,https://media.alj.com/app/uploads/2020/11/9.jpg,big-image,https://media.alj.com/app/uploads/2020/11/1980SA1.jpg,,08/14/1981,,alj,SA,,,,,1,1,"2020-11-16 11:27:45",publish,1980s-a-growing-team
81398,"1980s - Founder and son","<p>Pictured:  (seated left) Sheikh Abdul Latif Jameel, (standing right) Mohammed Jameel.</p>",en,,670623,"<p>After graduating from MIT in 1978, Mohammed Jameel worked alongside his father and company founder, Sheikh Abdul Latif Jameel in growing the business.</p>",image,https://media.alj.com/app/uploads/2020/11/24.jpg,,,https://media.alj.com/app/uploads/2020/11/24.jpg,big-image,https://media.alj.com/app/uploads/2020/11/1980SA2.jpg,,09/30/1980,,alj,SA,,,,,1,1,"2020-11-16 11:37:45",publish,1980s-founder-and-son
81413,"1980s - First national parts distribution center inaugurated","<p>Pictured:  (center) Sheikh Abdul Latif Jameel at a celebratory 'al-fresco' lunch with guests from Toyota Motor Corporation at the inauguration of Abdul Latif Jameel's first national vehicle parts distribution center in the 1980s.</p>",en,,670626,"<p>With ever more Toyota vehicles on Saudi Arabian roads, Abdul Latif Jameel opened its' first national parts distribution center outside Jeddah, Saudi Arabia to ensure best in class customer services and parts availability.</p>",image,https://media.alj.com/app/uploads/2020/11/29.jpg,,,https://media.alj.com/app/uploads/2020/11/29.jpg,big-image,https://media.alj.com/app/uploads/2020/11/1980SO1.jpg,,04/15/1982,,alj,SA,,,,,1,1,"2020-11-16 11:47:22",publish,1980s-first-national-parts-distribution-center-inaugurated
81428,"1980s - Our relationship with Toyota goes from strength to strength","<p>Pictured: (left) Ahmed Abdulhamid, (center) Sheikh Abdul Latif Jameel and (right) grandson Fady Jameel, welcome the visiting Senior Vice President of Toyota Motor Corporation (far left) to Jeddah, Saudi Arabia, late 1980s.</p>
<p>Over two decades since being appointed as Toyota Motor Corporation's distribution partner in Saudi Arabia, the relationship built on shared values, mutual trust and understanding continues to go from strength to strength as the third generation of the Jameel family starts to become involved.</p>",en,,670629,"<p>Building on shared values, mutual respect and understanding with a focus on the customer.</p>",image,https://media.alj.com/app/uploads/2020/11/50.jpg,,,https://media.alj.com/app/uploads/2020/11/50.jpg,big-image,https://media.alj.com/app/uploads/2020/11/1980SA3.jpg,,05/20/1987,,alj,SA,,,,,1,1,"2020-11-16 13:21:08",publish,1980s-our-relationship-with-toyota-goes-from-strength-to-strength
81443,"1987 - Saudi Arabian Toyota Dealer Award Ceremony","<p>Pictured: Three generations of the Jameel family, (left seated) Sheikh Abdul Latif Jameel, (center, standing) Fady Jameel and (right seated) Mohammed Jameel preside over the 1987 Saudi Arabian dealer awards, Jeddah, Saudi Arabia.</p>",en,,670635,"<p>Rewarding performance and a focus on continuous improvement to delivery the best customer experience.</p>",image|image,https://media.alj.com/app/uploads/2020/11/33.jpg|https://media.alj.com/app/uploads/2020/11/40.jpg,|,|,https://media.alj.com/app/uploads/2020/11/33.jpg,big-image,https://media.alj.com/app/uploads/2020/11/14-03-1.jpg,,03/14/1987,,alj,SA,,,,,1,1,"2020-11-16 13:32:07",publish,1987-saudi-arabian-toyota-dealer-award-ceremony
81466,"1990s - Expansion continues at home and abroad","<p>Pictured: (center seated) Sheikh Abdul Latif Jameel, and (standing right) Mohammed Jameel welcome senior executives from Toyota Motor Corporation on their visit to Saudi Arabia in the early 1990s.</p>
<p>In the 1990s, expansion in Saudi Arabia continued, building upon  Abdul Latif Jameel's  launch of the new Lexus luxury passenger car brand from Toyota Motor Corporation in Saudi Arabia in 1989, and the creation of a new vehicle conversion and accessories business.</p>
<p>The decade would also see international expansion into Algeria, Morocco, Japan and China.</p>",en,,670636,"<p>The 1990s saw continued success with expansion of our partnership with Toyota, in both Saudi Arabia and internationally.  It would also see entry into new business sectors such as advertising and media.</p>",image,https://media.alj.com/app/uploads/2020/11/37.jpg,,,https://media.alj.com/app/uploads/2020/11/37.jpg,big-image,https://media.alj.com/app/uploads/2020/11/1990SA1.jpg,,01/01/1990,,alj,SA,,,,,1,1,"2020-11-16 13:43:47",publish,1990s-expansion-continues-at-home-and-abroad
81481,"1990s - The continuous improvement philosophy remains key","<p>Pictured: (left) Mohammed Jameel and (right) Sheikh Abdul Latif Jameel at the Abdul Latif Jameel Center for Continuous Learning (ACCL) in Jeddah, Saudi Arabia, late 1990s.</p>",en,,670639,"<p>Throughout the decades, a relentless focus on learning and continuous improvement have remained key to Abdul Latif Jameel's success, and is exemplified by the ACCL facility.</p>",image,https://media.alj.com/app/uploads/2020/11/21-scaled.jpg,,,https://media.alj.com/app/uploads/2020/11/21-scaled.jpg,big-image,https://media.alj.com/app/uploads/2020/11/1990SM1.jpg,,01/01/1998,,alj,SA,,,,,1,1,"2020-11-16 13:51:21",publish,1990s-the-continuous-improvement-philosophy-remains-key
81496,"1990s - Toyota presidential visit to Abdul Latif Jameel","<p>Pictured:  (seated center) Sheikh Abdul Latif Jameel and (standing) Mohammed Jameel, speaking at an honorary dinner for the visit of Mr. Tatsuro Toyoda, President, Toyota Motor Corporation (seated center left) to Abdul Latif Jameel, Jeddah, mid-1990s.</p>",en,,670642,"<p>Mr. Tatsuro Toyoda, President, Toyota Motor Corporation visits Abdul Latif Jameel - now one of the world's leading independent Toyota distributors.</p>",image,https://media.alj.com/app/uploads/2020/11/30.jpg,,,https://media.alj.com/app/uploads/2020/11/30.jpg,big-image,https://media.alj.com/app/uploads/2020/11/1990SA3.jpg,,06/20/1995,,alj,SA,,,,,1,1,"2020-11-17 04:09:15",publish,1990s-toyota-presidential-visit-to-abdul-latif-jameel
81515,"1932 - Forming a business vision","<p>Pictured: (center) the young entrepreneur, Abdul Latif Jameel, sitting between two prominent Saudi Arabian businessmen at home, Jeddah in the early 1930s.</p>",en,,670645,"<p>As a young man, Abdul Latif Jameel could already see the opportunities in the rapidly developing country of Saudi Arabia.</p>",image,https://media.alj.com/app/uploads/2020/11/Sheikh-Abdul-Latif-Jameel-with-two-business-associates-1932-680x378-1.jpg,,,https://media.alj.com/app/uploads/2020/11/Abdul-Latif-Jameel-with-two-business-associates-1932-220x122-1.jpg,big-image,https://media.alj.com/app/uploads/2020/11/Sheikh-Abdul-Latif-Jameel-with-two-business-associates-1932-450x250-1.jpg,,06/30/1932,,alj,SA,,,,,1,1,"2020-11-18 05:22:26",publish,1930s-forming-a-business-vision
81530,"1960s - A family business","<p>Pictured: (left) Sheikh Abdul Latif Jameel in a business discussion with his son (right) Mohammed Jameel, at an Abdul Latif Jameel Toyota Center showroom, Jeddah in the mid 1960s.</p>",en,,670648,"<p>The Abdul Latif Jameel Toyota distributorship continues to develop and grow through the 1960s.</p>",image,https://media.alj.com/app/uploads/2020/11/3-630X1.jpg,,,https://media.alj.com/app/uploads/2020/11/3-630X1.jpg,big-image,https://media.alj.com/app/uploads/2020/11/3-630x378_2.jpg,,07/25/1965,,alj,SA,,,,,1,1,"2020-11-18 06:35:07",publish,1960s-a-family-affair
81545,"1950s - Founder and future Chairman","<p>Pictured: (left) Mohammed Jameel as a young boy seated with his father (right) Sheikh Abdul Latif Jameel, at home in Jeddah, Saudi Arabia, 1950s.</p>",en,,670651,"<p>Father and son enjoy a family moment at home.</p>",image,https://media.alj.com/app/uploads/2020/11/34-6301.jpg,,,https://media.alj.com/app/uploads/2020/11/34-6301.jpg,big-image,https://media.alj.com/app/uploads/2020/11/34-630x378_2.jpg,,07/20/1954,,alj,SA,,,,,1,1,"2020-11-18 06:42:59",publish,1950s-founder-and-future-chairman
81560,"1990s - The third generation","<p>Pictured:  (far left) Hassan Jameel, (left) Fady Jameel,  (front right) Hussein Jameel with their proud grandfather, (right) Sheikh Abdul Latif Jameel,  Jeddah, Saudi Arabia, 1990s.</p>
<p>As a successful family business, today celebrating 75 years, our Founder's grandsons, Fady, Hassan and Hussein share a family moment here - they will later take up key leadership positions across the organization.</p>",en,,670654,"<p>Sheikh Abdul Latif Jameel enjoys a family moment with his grandsons at home in Jeddah, Saudi Arabia.</p>",image,https://media.alj.com/app/uploads/2020/11/31-6301.jpg,,,https://media.alj.com/app/uploads/2020/11/31-6301.jpg,big-image,https://media.alj.com/app/uploads/2020/11/31-630x375_2.jpg,,10/10/1998,,alj,SA,,,,,1,1,"2020-11-18 07:09:06",publish,1980s-the-third-generation
